<?xml version="1.0" encoding="UTF-8" standalone="yes"?>
<xs:schema version="1.0" xmlns:xs="http://www.w3.org/2001/XMLSchema">

	<xs:include schemaLocation="../import.xsd" />

	<xs:element name="skill_data" type="skillData" />

	<xs:complexType name="skillData">
		<xs:sequence>
			<xs:element ref="import" minOccurs="0" maxOccurs="unbounded" />
			<xs:element name="skill_template" type="SkillTemplate" minOccurs="0" maxOccurs="unbounded" />
		</xs:sequence>
	</xs:complexType>

  <xs:simpleType name="Element">
    <xs:restriction base="xs:string">
      <xs:enumeration value="NONE"/>
    	<xs:enumeration value="FIRE"/>
    	<xs:enumeration value="EARTH"/>
    	<xs:enumeration value="WIND"/>
    	<xs:enumeration value="WATER"/>
    </xs:restriction>
  </xs:simpleType>
  
  <xs:simpleType name="Type">
    <xs:restriction base="xs:string">
    	<xs:enumeration value="DEFAULT"/>
    	<xs:enumeration value="SPELL_OBJECT"/>
    	<xs:enumeration value="SPELL_SIMPLE"/>
    	<xs:enumeration value="HEAL_OBJECT"/>
    	<xs:enumeration value="HEAL_SIMPLE"/>
    </xs:restriction>
  </xs:simpleType>
  
  <xs:simpleType name="Probability">
		<xs:restriction base="xs:float">
			<xs:minInclusive value="0.0"/>
			<xs:maxInclusive value="100.0"/>
		</xs:restriction>
	</xs:simpleType>
		
	<xs:complexType name="SkillTemplate">
		<xs:attribute name="skill_id" type="SkillId" use="required" />
		<xs:attribute name="name" type="xs:string" use="required" />
		<xs:attribute name="level" type="xs:int" use="required" />
		<xs:attribute name="skill_type" type="Type" default="DEFAULT" />
		<xs:attribute name="inflicts" type="xs:int" default="0" />
		<xs:attribute name="heals" type="xs:int" default="0" />
		<xs:attribute name="element" type="Element" default="NONE" />
		<xs:attribute name="cost" type="xs:int" default="0" />
		<xs:attribute name="probability" type="Probability" default="100.0" />
		<xs:attribute name="recharge_time" type="xs:int" default="0" />
		<xs:attribute name="launch_time" type="xs:int" default="0" />
		<xs:attribute name="target" type="skillTarget" default="TARGET" />
	</xs:complexType>
	
	<xs:simpleType name="skillTarget">
		<xs:restriction base="xs:string">
			<xs:enumeration value="TARGET" />
			<xs:enumeration value="TARGET_SELF" />
			<xs:enumeration value="SELF" />
			<xs:enumeration value="LOCATION" />
		</xs:restriction>
	</xs:simpleType>
	
	<xs:simpleType name="skillId">
		<xs:restriction base="xs:int">
			<xs:minInclusive value="1"/>
			<xs:maxInclusive value="60000"/>
		</xs:restriction>
	</xs:simpleType>

</xs:schema>

